{
  "schema": "specmetry.source-list/v1",
  "excerpt_storage": "hash_only",
  "source_set_hash": "3b5d9f0c1e2a4b6c8d0e1f2a3b4c5d6e7f8091a2b3c4d5e6f708192a3b4c5d6e",
  "sources": [
    {
      "id": "01J9Z3K5Q8R2T4V6W8X0Y2Z4E0",
      "path": "docs/client-brief.md",
      "location": "in_repo",
      "kind": "client_requirement",
      "acked_sha256": "9a8b7c6d5e4f3a2b1c0d9e8f7a6b5c4d3e2f1a0b9c8d7e6f5a4b3c2d1e0f9a8b",
      "current_sha256": "1f2e3d4c5b6a79881f2e3d4c5b6a79881f2e3d4c5b6a79881f2e3d4c5b6a7988",
      "state": "changed",
      "size_bytes": 5120,
      "registered_seq": 12,
      "removed_seq": null,
      "refs": [
        {
          "seq": 31,
          "entity_type": "requirement",
          "entity_key": "REQ-002",
          "entity_revision": 2,
          "current": true,
          "locator": "§3 第 2 段",
          "verification": "verified",
          "excerpt_sha256": "5d41402abc4b2a76b9719d911017c5925d41402abc4b2a76b9719d911017c592",
          "excerpt_state": "not_stored",
          "excerpt": null
        },
        {
          "seq": 18,
          "entity_type": "requirement",
          "entity_key": "REQ-002",
          "entity_revision": 1,
          "current": false,
          "locator": "§3",
          "verification": "verified",
          "excerpt_sha256": "7c211433f02071597741e6ff5a8ea34789abbf437c211433f02071597741e6ff",
          "excerpt_state": "stored",
          "excerpt": "用户只能查看自己创建的订单"
        }
      ]
    },
    {
      "id": "01J9Z3K5Q8R2T4V6W8X0Y2Z4E1",
      "path": "/home/dev/客户资料/会议纪要 0912.md",
      "location": "external",
      "kind": "note",
      "acked_sha256": "5d41402abc4b2a76b9719d911017c5925d41402abc4b2a76b9719d911017c592",
      "current_sha256": null,
      "state": null,
      "size_bytes": 2048,
      "registered_seq": 14,
      "removed_seq": 52,
      "refs": []
    }
  ]
}
